meal_id,name,calories
63,"Bread, toasted, wheat",313
91,"Crackers, whole-wheat",427
160,Barley flour or meal,345
162,"Garlic bread, frozen",350
171,"Rolls, wheat, dinner",273
179,"Bread, cracked-wheat",260
181,"Barley, raw, pearled",352
222,"Bread, toasted, rye",284
231,"Bread sticks, plain",412
234,"Bread, pumpernickel",250
242,"Bread, toasted, egg",315
295,"Bread, white wheat",238
299,"Rolls, rye, dinner",286
326,Vital wheat gluten,370
346,"Rye flour, medium",349
348,"Bread, wheat bran",248
353,Barley malt flour,361
370,"Wheat germ, crude",360
371,"Wheat, hard white",342
372,"Wheat bran, crude",216
394,"Wheat, soft white",340
405,"Bread, rice bran",243
417,"Rye flour, light",357
450,"Oil, wheat germ",884
451,"Bread, oat bran",236
458,"Rye flour, dark",325
469,"Breadfruit, raw",103
477,"Wheat, sprouted",198
481,"Bread, cinnamon",253
495,"Bread, oatmeal",269
496,"Bread, italian",271
509,"Barley, hulled",354
550,"Bagels, wheat",250
563,"Bread, cheese",408
564,"Bread, potato",266
589,"Bread, wheat",267
598,"Wheat, durum",339
608,Phyllo dough,299
643,"Bread, rye",259
651,"Bread, egg",287
652,Buckwheat,343
656,Rye grain,338
677,Oats,389
683,"Wheat flour, whole-grain",340
717,"Crustaceans, raw, queen, crab",90
718,"Wheat, cooked, KAMUT khorasan",132
766,"Bread, bollilo, Mexican, roll",318
774,"English muffins, whole-wheat",203
776,"Crackers, wheat, melba toast",374
778,"Crackers, plain, wafers, rye",334
796,"PEPPERIDGE FARM, White Bread",280
808,"Tennis Bread, plain (Apache)",258
827,"Bread, toasted, pumpernickel",275
828,"Bread, enriched, white, pita",275
830,"Muffins, dry mix, wheat bran",396
836,"Buckwheat flour, whole-groat",335
863,"Crackers, whole-wheat, matzo",351
869,"Seeds, raw, breadfruit seeds",191
877,"Crustaceans, raw, blue, crab",87
880,"Crackers, reduced fat, wheat",444
898,"Bread, rye, reduced-calorie",203
939,"Bread, canned, boston brown",195
1007,"Bread, toasted, wheat germ",293
1008,"Bread, kneel down (Navajo)",195
1014,"Cake, dry mix, gingerbread",437
1020,"Rolls, whole-wheat, dinner",266
1046,"Pasta, cooked, whole-wheat",149
1059,"Bread, unenriched, raisin",274
1076,"Bread, toasted, rice bran",264
1108,"Crackers, rye, crispbread",366
1116,"Crackers, low salt, wheat",473
1139,Rice and Wheat cereal bar,409
1149,"Bread, toasted, oat bran",259
1188,"Bread, whole-wheat, pita",262
1197,"Crackers, regular, wheat",455
1262,"Bread, enriched, raisin",274
1263,"Bread, toasted, oatmeal",292
1278,"Barley, cooked, pearled",123
1295,"Pasta, dry, whole-wheat",352
1308,"English muffins, wheat",223
1315,"Bread, sprouted, wheat",188
1327,"Cereals, dry, WHEATENA",357
1353,"Wheat, hard red spring",329
1354,"Wheat, soft red winter",331
1355,"Wheat, hard red winter",327
1372,"KEEBLER, Wheat Crackers, TOASTEDS",466
1392,"Crustaceans, raw, alaska king, crab",84
1398,"Bread, sweet yeast bread, pan dulce",367
1418,"Cookies, refrigerated dough, sugar",436
1452,"Bread stuffing, dry mix, cornbread",389
1466,"Doughnuts, glazed, french crullers",412
1484,"Crackers, reduced fat, whole-wheat",416
1497,"Wheat flour, enriched, cake, white",362
1510,"Focaccia, plain, Italian flatbread",249
1524,"Frybread, made with lard (Apache)",309
1554,"Frybread, made with lard (Navajo)",330
1556,"PEPPERIDGE FARM, Deli Swirl Bread",247
1578,"Crustaceans, raw, dungeness, crab",86
1580,"Bread, somiviki (Hopi), blue corn",186
1589,"Seeds, dried, breadnut tree seeds",367
1593,"Chicken, fried, breaded, meatless",234
1601,"Buckwheat groats, cooked, roasted",92
1632,"Soup, ready to serve, beef barley",52
1636,"Pie crust, dry mix, standard-type",518
1660,"Bread crumbs, plain, grated, dry",395
1690,"Cereals, Dry, Quick Oats, QUAKER",371
1691,"Cookies, reduced fat, shortbread",451
1695,"Seeds, roasted, breadfruit seeds",207
1723,"Bread, oat bran, reduced-calorie",201
1724,"Bread, toasted, enriched, raisin",297
1725,"Bread, protein (includes gluten)",245
1782,"English muffins, toasted, wheat",243
1787,"Crackers, seasoned, wafers, rye",381
1794,"Bread, oatmeal, reduced-calorie",210
1804,"Bread, toasted, sprouted, wheat",205
1818,"Crustaceans, canned, blue, crab",83
1819,"Wheat, uncooked, KAMUT khorasan",337
1831,"Seeds, boiled, breadfruit seeds",168
1832,"Seeds, raw, breadnut tree seeds",217
1854,"Crackers, low salt, whole-wheat",443
1874,"Wheat flours, unenriched, bread",361
1902,"Buckwheat groats, dry, roasted",346
1912,"Bread, unenriched, white, pita",275
1947,"Bread stuffing, dry mix, bread",386
2020,"Bread, wheat, reduced-calorie",217
2021,"Bread, white, reduced-calorie",207
2040,"KEEBLER, Wheat Crackers, TOWN HOUSE",489
2065,"PIZZA HUT 14"" Pepperoni Pizza, Pan Crust",291
2073,"Pancakes, incomplete, dry mix, buckwheat",340
2097,"PAPA JOHN'S 14"" Cheese Pizza, Thin Crust",295
2111,"Bread, prepared from recipe, irish soda",290
2116,"Turkey sticks, fried, battered, breaded",279
2129,"Cake, prepared from recipe, gingerbread",356
2144,"Pie crust, baked, regular, refrigerated",506
2148,"Babyfood, dry fortified, barley, cereal",376
2222,"PIZZA HUT, parmesan garlic, breadstick",343
2248,"PIZZA HUT 14"" Sausage Pizza, Pan Crust",287
2300,"MURRAY, Shortbread Cookies, SUGAR FREE",431
2350,"PEPPERIDGE FARM, Cinnamon Swirl Bread",300
2351,"English muffins, toasted, whole-wheat",221
2393,"Cereals, dry, instant, CREAM OF WHEAT",366
2421,"Fast foods, breaded and fried, shrimp",308
2430,"PIZZA HUT 12"" Cheese Pizza, Pan Crust",280
2465,"PIZZA HUT 14"" Cheese Pizza, Pan Crust",276
2481,"Bread, whole wheat, french or vienna",239
2499,"MURRAY, Shortbread Bites, SUGAR FREE",371
2563,"Cereals, cooked with water, WHEATENA",56
2565,"Cookies, refrigerated dough, oatmeal",424
2572,"Wheat flour, soft wheat, whole-grain",332
2610,"Snacks, rye, brown rice, rice cakes",386
2627,"PEPPERIDGE FARM, Pumpernickel Bread",259
2651,"Crustaceans, raw, northern, lobster",77
2687,"Bread crumbs, seasoned, grated, dry",383
2701,"Wheat flour, enriched, bread, white",361
2725,"Crustaceans, canned, mixed species, shrimp",100
2756,"MURRAY, Pecan Shortbread Cookies, SUGAR FREE",514
2789,"PEPPERIDGE FARM, Jewish Rye Bread (Seedless)",253
2790,"Bread stuffing, prepared, dry mix, cornbread",179
2818,"Cereals, dry, whole wheat hot natural cereal",342
2820,"Bread, french or vienna (includes sourdough)",272
2830,"Snacks, unsalted, wheat-based, sesame sticks",541
2844,"Beef, raw, sweetbread, imported, New Zealand",303
2859,"Lamb, raw, sweetbread, imported, New Zealand",72
2869,"PAPA JOHN'S 14"" Cheese Pizza, Original Crust",260
2877,"Chicken, raw, skin only, broilers or fryers",349
2878,"Chicken, raw, meat only, broilers or fryers",119
2925,"KEEBLER, Simply Shortbread Cookies, SANDIES",528
2931,"Crustaceans, moist heat, cooked, blue, crab",83
2937,"PEPPERIDGE FARM, Whole Grain 15 Grain Bread",270
2953,"KEEBLER, Cashew Shortbread Cookies, SANDIES",535
2956,"Wheat flour, unenriched, all-purpose, white",364
2967,"Cookies, baked, refrigerated dough, oatmeal",471
2974,"Cookies, refrigerated dough, chocolate chip",451
3008,"LITTLE CAESARS 14"" Cheese Pizza, Thin Crust",309
3029,"Wheat flour, enriched, tortilla mix, white",405
3036,"Chicken, reheated, breaded, frozen, thighs",334
3053,"KEEBLER, Shortbread Pie Crust, READY CRUST",502
3064,"Bread, toasted, (includes gluten), protein",270
3068,"PEPPERIDGE FARM, Farmhouse Sourdough Bread",269
3069,"Breakfast bar, corn flake crust with fruit",377
3070,"Snacks, salted, wheat-based, sesame sticks",541
3084,"Pancakes, incomplete, dry mix, whole wheat",350
3123,"KEEBLER, Pecan Shortbread Cookies, SANDIES",541
3129,"Cookies, refrigerated dough, peanut butter",458
3137,"Fast foods, breaded and fried, onion rings",411
3139,"PEPPERIDGE FARM, Whole Grain Oatmeal Bread",258
3152,"Pancakes, incomplete, dry mix, whole-wheat",344
3153,"Cereals, Dry, Quick Oats with Iron, QUAKER",371
3161,"KEEBLER, Cheese on Wheat Sandwich Crackers",499
3163,"Chicken tenders, prepared, frozen, breaded",240
3178,"Piki bread, made from blue cornmeal (Hopi)",390
3187,"Bread, commercially prepared, whole-wheat",252
3189,"KEEBLER, Honey Wheat Crackers, WHEATABLES",482
3194,"Cookies, baked, refrigerated dough, sugar",489
3199,"Bread, toasted, oat bran, reduced-calorie",239
3200,"KEEBLER, Chocolate Pie Crust, READY CRUST",490
3202,"Chicken breast tenders, uncooked, breaded",263
3211,"T.G.I. FRIDAY'S, breaded, FRIDAY'S Shrimp",302
3213,Soy sauce made from soy and wheat (shoyu),53
3241,"Chicken, raw, giblets, broilers or fryers",124
3248,"Biscuits, refrigerated dough, mixed grain",263
3255,"KEEBLER, Holiday, Gingerbread Men Cookies",444
3262,"PIZZA HUT 14"" Cheese Pizza, Stuffed Crust",274
3268,"Pie crust, unbaked, regular, refrigerated",445
3286,"Snacks, buckwheat, brown rice, rice cakes",380
3296,"Bread, multi-grain (includes whole-grain)",265
3297,"KEEBLER, Saltines with Whole Wheat, ZESTA",416
3314,"Bread, prepared from recipe, whole-wheat",278
3318,"PEPPERIDGE FARM, Light Style Wheat Bread",256
3340,"PEPPERIDGE FARM, Farmhouse Oatmeal Bread",275
3342,"Rolls, whole wheat, hamburger or hot dog",269
3347,"Soup, condensed, canned, mushroom barley",61
3362,"KASHI, Original, H2H Woven Wheat Cracker",396
3363,"Bread stuffing, prepared, dry mix, bread",195
3393,"PIZZA HUT 12"" Pepperoni Pizza, Pan Crust",298
3398,"PEPPERIDGE FARM, Seeded Jewish Rye Bread",256
3402,"Cereals, dry, plain, fortified, instant, oats",362
3404,"Crustaceans, raw, mixed species, spiny lobster",112
3413,"PIZZA HUT 12"" Pepperoni Pizza, Hand-Tossed Crust",280
3416,"PIZZA HUT 14"" Sausage Pizza, THIN 'N CRISPY Crust",323
3435,"Cookies, baked, refrigerated dough, peanut butter",503
3438,"PEPPERIDGE FARM, 100% Whole Wheat Hamburger Buns",257
3447,"Crackers, sandwich-type with cheese filling, rye",481
3448,"Restaurant, bunuelos (fried yeast bread), Latino",462
3451,"Crustaceans, moist heat, cooked, dungeness, crab",110
3474,"Rolls, wheat/cracked wheat, hamburger or hot dog",269
3475,"DENNY'S, fried, battered or breaded, fish fillet",234
3477,"Pizza, cooked, frozen, thick crust, meat topping",274
3489,"CAMPBELL'S CHUNKY Soups, Hearty Beef Barley Soup",56
3491,"Crustaceans, home recipe, crab cakes, blue, crab",155
3512,"Crustaceans, raw (not previously frozen), shrimp",85
3524,"Cereals, dry, 1 minute cook time, CREAM OF WHEAT",359
3527,"Chicken, raw, meat only, leg, broilers or fryers",120
3534,"PIZZA HUT 12"" Cheese Pizza, THIN 'N CRISPY Crust",303
3543,"Cereals ready-to-eat, plain, toasted, wheat germ",382
3552,"PIZZA HUT 14"" Pepperoni Pizza, Hand-Tossed Crust",291
3556,"Cereals, dry, Whole Wheat Natural Cereal, QUAKER",333
3571,"DOMINO'S 14"" Pepperoni Pizza, Crunchy Thin Crust",328
3589,"PIZZA HUT 14"" Cheese Pizza, THIN 'N CRISPY Crust",306
3597,"School Lunch, whole grain breaded, chicken patty",246
3601,"Chicken, roasted, meat only, broilers or fryers",190
3628,"POPEYES, Skin and Breading, Mild, Fried Chicken",433
3652,"Crustaceans, raw, wild, mixed species, crayfish",77
3678,"Cereals, with salt, cooked with water, WHEATENA",59
3682,"Chicken, raw, meat and skin, broilers or fryers",215
3684,"Crackers, with whole wheat, standard snack-type",463
3690,"Chicken, raw, separable fat, broilers or fryers",629
3711,"Cereals ready-to-eat, Wheat CHEX, GENERAL MILLS",345
3733,"PAPA JOHN'S 14"" The Works Pizza, Original Crust",240
3740,"PAPA JOHN'S 14"" Pepperoni Pizza, Original Crust",275
3744,"Bread, pan de torta salvadoran, pound cake type",390
3751,"Chicken, stewed, meat only, broilers or fryers",177
3813,"Pie Crust, Ready Crust, Chocolate, Cookie-type",484
3823,"Doughnuts, sugared or glazed, plain, cake-type",426
3830,"Crackers, with cheese filling, sandwich, wheat",497
3838,"KASHI, Roasted Garlic, H2H Woven Wheat Cracker",440
3863,"Cereals ready-to-eat, fortified, puffed, wheat",364
3885,"PIZZA HUT 14"" Sausage Pizza, Hand-Tossed Crust",287
3886,"DOMINO'S 14"" Sausage Pizza, Crunchy Thin Crust",319
3948,"Tortillas, whole wheat, ready-to-bake or -fry",310
3967,"PEPPERIDGE FARM, Farmhouse Hearty White Bread",267
3991,"Doughnuts, with jelly filling, yeast-leavened",340
3992,"Doughnuts, with creme filling, yeast-leavened",361
4008,"DOMINO'S 14"" Cheese Pizza, Crunchy Thin Crust",298
4009,"PIZZA HUT 12"" Cheese Pizza, Hand-Tossed Crust",271
4017,"Cereals ready-to-eat, WHEATIES, GENERAL MILLS",353
4054,"PIZZA HUT 14"" Cheese Pizza, Hand-Tossed Crust",275
4065,"PEPPERIDGE FARM, Raisin Cinnamon Swirl Bread",286
4075,"Bread, toasted, commercially prepared, white",290
4078,"Crustaceans, moist heat, cooked, queen, crab",115
4096,"DOMINO'S 14"" Sausage Pizza, Classic Hand-Tossed Crust",273
4106,"Wheat flour, unbleached, enriched, all-purpose, white",364
4121,"Chicken, raw, meat and skin, back, broilers or fryers",319
4126,"KEEBLER, bite size, Pecan Shortbread Cookies, SANDIES",547
4127,"Crackers, with peanut butter filling, sandwich, wheat",495
4132,"Chicken, raw, meat and skin, neck, broilers or fryers",297
4146,"Chicken, raw, meat and skin, wing, broilers or fryers",191
4156,"Soy sauce made from soy and wheat (shoyu), low sodium",57
4163,"Pie crust, baked, prepared from recipe, standard-type",527
4179,"Formulated bar, oats and chocolate, chewy, high fiber",350
4191,"Chicken, raw, meat and skin, leg, broilers or fryers",214
4220,"Bread, commercially prepared, plain, chapati or roti",297
4225,"Cereals, dry, not fortified, regular and quick, oats",379
4227,"DOMINO'S 14"" Sausage Pizza, Ultimate Deep Dish Crust",277
4229,"Mollusks, breaded and fried, cooked, eastern, oyster",199
4232,"Pancakes, prepared, incomplete, dry mix, whole-wheat",208
4260,"Pizza, cooked, frozen, regular crust, cheese topping",268
4276,"Cereals, dry, 2 1/2 minute cook time, CREAM OF WHEAT",355
4278,"PIZZA HUT 12"" Super Supreme Pizza, Hand-Tossed Crust",243
4279,"DOMINO'S 14"" Cheese Pizza, Classic Hand-Tossed Crust",257
4286,"Cereals ready-to-eat, Honey Nut Shredded Wheat, POST",373
4308,"PEPPERIDGE FARM, Whole Grain Honey Whole Wheat Bread",263
4320,"PIZZA HUT 14"" Super Supreme Pizza, Hand-Tossed Crust",248
4326,"UDI'S, Soft & Hearty Whole Grain Bread, Gluten Free",309
4335,"SCHAR, Classic White Bread, Wheat-Free, Gluten-Free",240
4338,"Waffles, ready-to-heat, frozen, lowfat, whole wheat",257
4341,"Chicken breast tenders, microwaved, cooked, breaded",252
4348,"PEPPERIDGE FARM, Whole Grain 100% Whole Wheat Bread",263
4364,"RUDI'S, Original Sandwich Bread, Gluten-Free Bakery",320
4377,"Pie Crust, Ready Crust, Graham Cracker, Cookie-type",501
4378,"Chicken, fried, cooked, giblets, broilers or fryers",277
4379,"Onion rings, unprepared, frozen, par fried, breaded",258
4387,"Crustaceans, cooked (not previously frozen), shrimp",99
4388,"Pizza, cooked, frozen, rising crust, cheese topping",260
4407,"DOMINO'S 14"" Cheese Pizza, Ultimate Deep Dish Crust",265
4409,"Cereals, dry, Banana Bread, Instant Oatmeal, QUAKER",368
4416,"Restaurant, breaded and fried, shrimp, family style",308
4431,"Wheat flour, bleached, enriched, all-purpose, white",364
4435,"PIZZA HUT 14"" Pepperoni Pizza, THIN 'N CRISPY Crust",333
4444,"Snacks, unsalted, buckwheat, brown rice, rice cakes",380
4453,"KFC, Skin and Breading, EXTRA CRISPY, Fried Chicken",464
4461,"KELLOGG'S, Gingerbread Toaster Pastries, POP-TARTS",393
4470,"Bread, toasted, commercially prepared, whole-wheat",306
4474,"Crackers, rye (includes pumpernickel), melba toast",389
4475,"Cereals, dry, Farina Hot Wheat Cereal, MALT-O-MEAL",365
4483,"Bread, toasted (includes whole-grain), multi-grain",288
4516,"Crustaceans, moist heat, cooked, northern, lobster",89
4531,"Babyfood, prepared with whole milk, barley, cereal",84
4547,"Doughnuts, sugared or glazed, chocolate, cake-type",417
4573,"Fish, breaded and fried, cooked, Atlantic, croaker",221
4575,"Cookies, baked, refrigerated dough, chocolate chip",492
4599,"Pie crust, baked, prepared, dry mix, standard-type",501
4606,"Crustaceans, moist heat, cooked, alaska king, crab",97
4623,"School Lunch, whole grain breaded, chicken nuggets",270
4632,"Crustaceans, raw, farmed, mixed species, crayfish",72
4633,"Bread, toasted, prepared from recipe, whole-wheat",305
4637,"Chicken, raw, meat only, back, broilers or fryers",137
4640,"PEPPERIDGE FARM, Farmhouse 100% Whole Wheat Bread",269
4646,"Fish, breaded and fried, cooked, channel, catfish",229
4647,"Cookies, pecan, commercially prepared, shortbread",542
4648,"Cookies, plain, commercially prepared, shortbread",514
4654,"Pizza, cooked, frozen, thin crust, cheese topping",263
4669,"PILLSBURY, refrigerated dough, Crusty French Loaf",243
4673,"KEEBLER, Honey Wheat, Snack Sticks, CLUB Crackers",471
4675,"Cereals ready-to-eat, QUAKER Puffed Wheat, QUAKER",366
4726,"Chicken, raw, meat only, neck, broilers or fryers",154
4736,"Chicken, raw, meat only, wing, broilers or fryers",126
4764,"Shortening bread, soybean (hydrogenated) and cottonseed",884
4808,"Chicken, raw, meat and skin, drumstick, broilers or fryers",161
4820,"KEEBLER, Dark Chocolate Almond Shortbread Cookies, SANDIES",540
4827,"Chicken, fried, cooked, meat only, leg, broilers or fryers",208
4854,"Nuts, with salt added, unflavored, wheat-based, formulated",622
4856,"SUBWAY, meatball marinara sub on white bread (no toppings)",219
4863,"Bread, frozen, commercially prepared, whole wheat, paratha",326
4876,"Chicken, raw, meat and skin, dark meat, broilers or fryers",237
4878,"UDI'S, Soft & Delicious White Sandwich Bread, Gluten Free",298
4901,"Pie crust, enriched, ready-to-bake, frozen, standard-type",457
4911,"Cereals ready-to-eat, ORGANIC PROMISE Autumn Wheat, KASHI",338
4938,"PILLSBURY GRANDS, refrigerated dough, Buttermilk Biscuits",293
4949,"Babyfood, dry fortified, with apples, whole wheat, cereal",402
4956,"Soup, ready to serve, traditional, beef barley, PROGRESSO",47
4991,"KEEBLER, Reduced Fat, Graham Pie Crust (10""), READY CRUST",472
4998,"LITTLE CAESARS 14"" Pepperoni Pizza, Large Deep Dish Crust",265
5009,"Doughnuts, chocolate-coated or frosted, plain, cake-type",452
5015,"Bread, made with margarine, prepared from recipe, banana",326
5032,"Bread, no salt, low sodium, commercially prepared, white",267
5042,"PILLSBURY, refrigerated dough, Cinnamon Rolls with Icing",330
5058,"Cereals, dry, 10 minute cooking, regular, CREAM OF WHEAT",370
5112,"Mollusks, breaded and fried, cooked, mixed species, clam",202
5120,"Cereals ready-to-eat, RALSTON Enriched Wheat Bran flakes",310
5124,"Chicken, roasted, cooked, skin only, broilers or fryers",454
5134,"KEEBLER, Roasted Almond, Nut Crisp Crackers, WHEATABLES",472
5139,"Chicken, raw, meat and skin, breast, broilers or fryers",172
5148,"Muffins, toasted, toaster-type with raisins, wheat bran",313
5153,"Pizza, cooked, frozen, regular crust, pepperoni topping",274
5159,"Bread, refrigerated, commercially prepared, plain, naan",291
5192,"USDA Commodity, heated, frozen, breaded, salmon nuggets",212
5200,"KEEBLER, Reduced Fat, Pecan Shortbread Cookies, SANDIES",488
5210,"AUSTIN, sandwich-type, Cheddar Cheese on Wheat Crackers",495
5226,"Beef, boiled, cooked, sweetbread, imported, New Zealand",318
5229,"SUBWAY, tuna sub on white bread with lettuce and tomato",221
5242,"Sweet rolls, refrigerated dough with frosting, cinnamon",333
5244,"Pie crust, unbaked, prepared from recipe, standard-type",469
5248,"Bread, salvadoran sweet cheese (quesadilla salvadorena)",374
5249,"Chicken, raw, meat only, light meat, broilers or fryers",114
5250,"DOMINO'S 14"" Pepperoni Pizza, Classic Hand-Tossed Crust",273
5254,"Chicken, stewed, cooked, skin only, broilers or fryers",363
5262,"KEEBLER, Toasted Pecan, Nut Crisp Crackers, WHEATABLES",483
5269,"Chicken, raw, meat and skin, thigh, broilers or fryers",221
5305,"Crackers, whole wheat (includes multi-grain), saltines",398
5306,"KFC, Skin and Breading, ORIGINAL RECIPE, Fried Chicken",384
5309,"Chicken, simmered, cooked, giblets, broilers or fryers",157
5318,"Cereals ready-to-eat, Sweetened WHEAT-FULS, MOM'S BEST",373
5327,"Chicken, raw, meat only, dark meat, broilers or fryers",125
5338,"Wheat flour, enriched, self-rising, all-purpose, white",354
5384,"LITTLE CAESARS 14"" Cheese Pizza, Large Deep Dish Crust",263
5385,"Turkey, roasted, cooked, meat and skin, fryer-roasters",172
5390,"DOMINO'S 14"" Pepperoni Pizza, Ultimate Deep Dish Crust",283
5394,"Chicken, fried, cooked, meat only, broilers or fryers",219
5403,"Restaurant, arepa (unleavened cornmeal bread), Latino",219
5411,"Bread, toasted (includes sourdough), french or vienna",319
5432,"PILLSBURY, refrigerated dough, Chocolate Chip Cookies",450
5441,"Chicken, stewed, cooked, meat only, leg, broilers or fryers",185
5453,"Soup, prepared with equal volume water, canned, mushroom barley",30
5455,"Cereals, dry, Maple & Brown Sugar Hot Wheat Cereal, MALT-O-MEAL",368
5456,"Wheat flour, enriched, bleached, 13% protein, white (industrial)",362
5457,"Wheat flour, enriched, bleached, 15% protein, white (industrial)",362
5459,"Chicken, stewed, cooked, meat and skin, wing, broilers or fryers",249
5462,"Fast Food, thin crust, pepperoni topping, 14"" pizza, Pizza Chain",331
5463,"Fast foods, meatball marinara on white bread, submarine sandwich",219
5472,"LITTLE CAESARS 14"" Original Round Pepperoni Pizza, Regular Crust",273
5482,"DIGIORNO Pizza, baked, frozen, thin crispy crust, cheese topping",247
5489,"Doughnuts, plain (includes unsugared, old-fashioned), cake-type",434
5490,"Chicken, stewed, cooked, meat and skin, leg, broilers or fryers",220
5492,"Bread, made with low fat (2%) milk, prepared from recipe, white",285
5498,"Pizza, cooked, frozen, rising crust, meat and vegetable topping",271
5518,"Cereals ready-to-eat, original spoon-size, Shredded Wheat, POST",351
5523,"Cereals ready-to-eat, with almonds, HONEY BUNCHES OF OATS, POST",409
5532,"Cereals, dry, with cinnamon and spice, fortified, instant, oats",369
5534,"POPEYES, meat and skin with breading, Wing, Mild, Fried Chicken",338
5548,"Chicken, roasted, cooked, meat only, breast, broilers or fryers",165
5550,"Wheat flour, enriched, bleached, 9% protein, white (industrial)",367
5564,"Pie crust, made with enriched flour, unbaked, frozen, deep dish",468
5573,"Fast Food, thick crust, sausage topping, 14"" pizza, Pizza Chain",282
5580,"Crustaceans, made from surimi, imitation, mixed species, shrimp",101
5602,"Cereals ready-to-eat, spoon-size, Shredded Wheat n' Bran, POST",339
5613,"Chicken, simmered, cooked, meat only, neck, broilers or fryers",179
5614,"Chicken, roasted, cooked, meat only, thigh, broilers or fryers",179
5635,"Fast Food, thick crust, cheese topping, 14"" pizza, Pizza Chain",271
5636,"Crustaceans, moist heat, cooked, wild, mixed species, crayfish",82
5649,"Fast foods, plain, boneless pieces, breaded and fried, chicken",307
5650,"DIGIORNO Pizza, baked, frozen, rising crust, pepperoni topping",265
5652,"Chicken, stewed, cooked, meat only, breast, broilers or fryers",151
5668,"Bread, enriched (includes corn muffin mix), dry mix, cornbread",418
5681,"Fast Food, thin crust, sausage topping, 14"" pizza, Pizza Chain",321
5683,"SUBWAY, SUBWAY CLUB sub on white bread with lettuce and tomato",146
5696,"Sweet rolls, baked, refrigerated dough with frosting, cinnamon",362
5698,"Cereals, dry, with raisins and spice, fortified, instant, oats",360
5707,"Chicken, batter, fried, cooked, skin only, broilers or fryers",394
5712,"Bread, made with nonfat dry milk, prepared from recipe, white",274
5717,"Chicken, roasted, cooked, meat only, back, broilers or fryers",239
5719,"Crustaceans, moist heat, cooked, mixed species, spiny lobster",143
5725,"Cereals ready-to-eat, Big Bite, KELLOGG'S FROSTED MINI-WHEATS",350
5727,"Chicken, raw, meat only, thigh, dark meat, broilers or fryers",121
5728,"Chicken, stewed, cooked, meat only, thigh, broilers or fryers",195
5749,"Fast Food, thin crust, cheese topping, 14"" pizza, Pizza Chain",302
5763,"Pie crust, made with enriched flour, baked, frozen, deep dish",521
5768,"Chicken, fried, cooked, meat only, breast, broilers or fryers",187
5775,"Biscuits, higher fat, refrigerated dough, plain or buttermilk",307
5798,"SUBWAY, roast beef sub on white bread with lettuce and tomato",155
5802,"Chicken, roasted, cooked, meat only, wing, broilers or fryers",203
5823,"Crustaceans, breaded and fried, cooked, mixed species, shrimp",242
5825,"Bread, refrigerated, commercially prepared, whole wheat, naan",286
5826,"Cereals, banana bread, Weight Control Instant Oatmeal, QUAKER",361
5827,"Cereals, dry, maple and brown sugar, fortified, instant, oats",368
5828,"Fast Foods, meat and skin and breading, Breast, Fried Chicken",230
5832,"LITTLE CAESARS 14"" Original Round Cheese Pizza, Regular Crust",265
5837,"Chicken, flour, fried, cooked, skin only, broilers or fryers",502
5845,"Chicken, stewed, cooked, meat only, back, broilers or fryers",209
5853,"Chicken, fried, cooked, meat only, thigh, broilers or fryers",218
5863,"Wheat flour, calcium-fortified, enriched, all-purpose, white",364
5878,"DIGIORNO Pizza, baked, frozen, rising crust, supreme topping",255
5881,"Pickles, sweet (includes bread and butter pickles), cucumber",91
5882,"Biscuits, lower fat, refrigerated dough, plain or buttermilk",270
5889,"Fast Foods, meat and skin and breading, Thigh, Fried Chicken",274
5900,"KEEBLER, Sandies Shortbread Cookies, 100 Calorie RIGHT BITES",468
5907,"Chicken, roasted, cooked, meat only, leg, broilers or fryers",174
5919,"Chicken, stewed, cooked, meat only, wing, broilers or fryers",181
5943,"Fast Foods, Skin and breading from all pieces, Fried Chicken",398
5967,"Chicken, fried, cooked, meat only, back, broilers or fryers",288
6008,"Cereals ready-to-eat, bagged cereal, Shredded Wheat, QUAKER",348
6022,"Chicken, raw, meat and skin, light meat, broilers or fryers",186
6026,"Chicken, roasted, cooked, meat and skin, broilers or fryers",239
6029,"Fast Foods, meat and skin and breading, Wing, Fried Chicken",310
6038,"KEEBLER, Chocolate Chip & Pecan Shortbread Cookies, SANDIES",546
6043,"Chicken, fried, cooked, meat only, neck, broilers or fryers",229
6052,"Pie crust, unenriched, ready-to-bake, frozen, standard-type",457
6055,"Chicken, fried, cooked, meat only, wing, broilers or fryers",211
